{
  "schemaVersion": "0.1.0",
  "packageVersion": "0.4.0",
  "policySchemaVersion": "0.1.0",
  "sourceRoots": {
    "template": "template",
    "agents": "agents",
    "skills": "skills",
    "lean-pack": "packs/lean",
    "secure-pack": "packs/secure",
    "tdd-pack": "packs/tdd",
    "oss-pack": "packs/oss",
    "docs-pack": "packs/docs",
    "devops-pack": "packs/devops",
    "mlops-pack": "packs/mlops",
    "shapeup-pack": "packs/shapeup",
    "mcp": "mcp",
    "tools": "tools"
  },
  "generationSettings": {
    "manifestSchemaVersion": "0.1.0",
    "manifestOutput": "template/setup/install-manifest.json",
    "includeRetiredFiles": true,
    "derivedArtifactStrategy": {
      "catalog": "generated-from-policy-and-registries",
      "mirrors": [],
      "indexes": []
    },
    "unmanagedSourceExcludes": [
      "template/setup/**",
      "packs/*/tokens.json",
      "packs/*/evals/**",
      "tools/xanadEval/**"
    ]
  },
  "managedFiles": [
    {
      "id": "agents.cleaner.agent.md",
      "surface": "agents",
      "layer": "pack",
      "source": "agents/cleaner.agent.md",
      "target": ".github/agents/cleaner.agent.md",
      "ownership": [
        "local",
        "plugin-backed-copilot-format"
      ],
      "strategy": "token-replace",
      "requiredWhen": [],
      "tokens": [],
      "chmod": "none",
      "hash": "sha256:7416535a02ca2994e9870c08451ea81cec675b7e7687c2a1f73833e34e977e20"
    },
    {
      "id": "agents.commit.agent.md",
      "surface": "agents",
      "layer": "pack",
      "source": "agents/commit.agent.md",
      "target": ".github/agents/commit.agent.md",
      "ownership": [
        "local",
        "plugin-backed-copilot-format"
      ],
      "strategy": "token-replace",
      "requiredWhen": [],
      "tokens": [],
      "chmod": "none",
      "hash": "sha256:f642046e714e538adf7258dc6e3a2c12dd9d1213fd95ea116b82ec975aa58383"
    },
    {
      "id": "agents.debugger.agent.md",
      "surface": "agents",
      "layer": "pack",
      "source": "agents/debugger.agent.md",
      "target": ".github/agents/debugger.agent.md",
      "ownership": [
        "local",
        "plugin-backed-copilot-format"
      ],
      "strategy": "token-replace",
      "requiredWhen": [],
      "tokens": [],
      "chmod": "none",
      "hash": "sha256:4f0d7756ecbfdd40b8aad06a8fc6e14b163f4bcc9a9f756529c213b41fa162d0"
    },
    {
      "id": "agents.deps.agent.md",
      "surface": "agents",
      "layer": "pack",
      "source": "agents/deps.agent.md",
      "target": ".github/agents/deps.agent.md",
      "ownership": [
        "local",
        "plugin-backed-copilot-format"
      ],
      "strategy": "token-replace",
      "requiredWhen": [],
      "tokens": [],
      "chmod": "none",
      "hash": "sha256:eb27721ac00442f77004cb0e32d2be7aa3027e55c5ef71cdfa066a197ab192bf"
    },
    {
      "id": "agents.docs.agent.md",
      "surface": "agents",
      "layer": "pack",
      "source": "agents/docs.agent.md",
      "target": ".github/agents/docs.agent.md",
      "ownership": [
        "local",
        "plugin-backed-copilot-format"
      ],
      "strategy": "token-replace",
      "requiredWhen": [],
      "tokens": [],
      "chmod": "none",
      "hash": "sha256:423ff28934fe2d34b942a8d6ee76613414751502e7d3658538b3e016dc6e26c3"
    },
    {
      "id": "agents.explore.agent.md",
      "surface": "agents",
      "layer": "pack",
      "source": "agents/explore.agent.md",
      "target": ".github/agents/explore.agent.md",
      "ownership": [
        "local",
        "plugin-backed-copilot-format"
      ],
      "strategy": "token-replace",
      "requiredWhen": [],
      "tokens": [],
      "chmod": "none",
      "hash": "sha256:3b65dfa13d5a25c75628a4733acace2932e9dbdda4082071167b894776d8d4e2"
    },
    {
      "id": "agents.organise.agent.md",
      "surface": "agents",
      "layer": "pack",
      "source": "agents/organise.agent.md",
      "target": ".github/agents/organise.agent.md",
      "ownership": [
        "local",
        "plugin-backed-copilot-format"
      ],
      "strategy": "token-replace",
      "requiredWhen": [],
      "tokens": [],
      "chmod": "none",
      "hash": "sha256:6a94da11c8d3de812dae6874d246ba74913f13d5fcc9cfb5f8de59e23b9781ef"
    },
    {
      "id": "agents.planner.agent.md",
      "surface": "agents",
      "layer": "pack",
      "source": "agents/planner.agent.md",
      "target": ".github/agents/planner.agent.md",
      "ownership": [
        "local",
        "plugin-backed-copilot-format"
      ],
      "strategy": "token-replace",
      "requiredWhen": [],
      "tokens": [],
      "chmod": "none",
      "hash": "sha256:f88af3c684583771f0a5a886f1e8fb4d09a224491b63222e1a9cc6f0bca0276a"
    },
    {
      "id": "agents.researcher.agent.md",
      "surface": "agents",
      "layer": "pack",
      "source": "agents/researcher.agent.md",
      "target": ".github/agents/researcher.agent.md",
      "ownership": [
        "local",
        "plugin-backed-copilot-format"
      ],
      "strategy": "token-replace",
      "requiredWhen": [],
      "tokens": [],
      "chmod": "none",
      "hash": "sha256:1eaf484884f2567cb25b662b87ab764f7c739604b9ae63d1465ef3e1da4cbc8b"
    },
    {
      "id": "agents.review.agent.md",
      "surface": "agents",
      "layer": "pack",
      "source": "agents/review.agent.md",
      "target": ".github/agents/review.agent.md",
      "ownership": [
        "local",
        "plugin-backed-copilot-format"
      ],
      "strategy": "token-replace",
      "requiredWhen": [],
      "tokens": [],
      "chmod": "none",
      "hash": "sha256:a1ac24be4289214d2d7eed8fee7bd787de11425338acaaa5dab4fe0be32c871c"
    },
    {
      "id": "agents.triage.agent.md",
      "surface": "agents",
      "layer": "pack",
      "source": "agents/triage.agent.md",
      "target": ".github/agents/triage.agent.md",
      "ownership": [
        "local",
        "plugin-backed-copilot-format"
      ],
      "strategy": "token-replace",
      "requiredWhen": [],
      "tokens": [],
      "chmod": "none",
      "hash": "sha256:2478dabb32a4b9fd037958bf4cecc9ed2325bffcb1c80a42188884bfcc34f928"
    },
    {
      "id": "agents.xanadLifecycle.agent.md",
      "surface": "agents",
      "layer": "pack",
      "source": "agents/xanadLifecycle.agent.md",
      "target": ".github/agents/xanadLifecycle.agent.md",
      "ownership": [
        "local",
        "plugin-backed-copilot-format"
      ],
      "strategy": "token-replace",
      "requiredWhen": [],
      "tokens": [],
      "chmod": "none",
      "hash": "sha256:ee40a31820738ade3840bd339b2c700a4e19bd76f792ebf71be2c2f37047fb4b"
    },
    {
      "id": "core-instructions.copilot-instructions.md",
      "surface": "instructions",
      "layer": "core",
      "source": "template/copilot-instructions.md",
      "target": ".github/copilot-instructions.md",
      "ownership": [
        "local"
      ],
      "strategy": "preserve-marked-markdown-blocks",
      "requiredWhen": [],
      "tokens": [
        "{{AGENT_PERSONA}}",
        "{{AUTONOMY_LEVEL}}",
        "{{PACKAGE_MANAGER}}",
        "{{PRIMARY_LANGUAGE}}",
        "{{RESPONSE_STYLE}}",
        "{{TESTING_PHILOSOPHY}}",
        "{{TEST_COMMAND}}",
        "{{WORKSPACE_NAME}}"
      ],
      "chmod": "none",
      "hash": "sha256:e710415477b18f8c6e7801c8cfaf964af4bddb01aea6df8acc2b150633704644"
    },
    {
      "id": "instructions.agents.instructions.md",
      "surface": "instructions",
      "layer": "core",
      "source": "template/instructions/agents.instructions.md",
      "target": ".github/instructions/agents.instructions.md",
      "ownership": [
        "local"
      ],
      "strategy": "token-replace",
      "requiredWhen": [],
      "tokens": [],
      "chmod": "none",
      "hash": "sha256:1e33cc96984865a112d1f75f1e393f432bd7007a486ad3d80e12abe11abb029e"
    },
    {
      "id": "instructions.evals.instructions.md",
      "surface": "instructions",
      "layer": "core",
      "source": "template/instructions/evals.instructions.md",
      "target": ".github/instructions/evals.instructions.md",
      "ownership": [
        "local"
      ],
      "strategy": "token-replace",
      "requiredWhen": [],
      "tokens": [],
      "chmod": "none",
      "hash": "sha256:a9dc6ce00e775fcd260d26d9693a5473143f735824043ddacefbd58f322900f4"
    },
    {
      "id": "instructions.scripts.instructions.md",
      "surface": "instructions",
      "layer": "core",
      "source": "template/instructions/scripts.instructions.md",
      "target": ".github/instructions/scripts.instructions.md",
      "ownership": [
        "local"
      ],
      "strategy": "token-replace",
      "requiredWhen": [],
      "tokens": [
        "{{PACKAGE_MANAGER}}",
        "{{PRIMARY_LANGUAGE}}"
      ],
      "chmod": "none",
      "hash": "sha256:f083b13358d3727989d6f99fce0ee45cd2a01e214df0a06c7db6ee54f0b70dd6"
    },
    {
      "id": "instructions.skills.instructions.md",
      "surface": "instructions",
      "layer": "core",
      "source": "template/instructions/skills.instructions.md",
      "target": ".github/instructions/skills.instructions.md",
      "ownership": [
        "local"
      ],
      "strategy": "token-replace",
      "requiredWhen": [],
      "tokens": [],
      "chmod": "none",
      "hash": "sha256:3aed5d7627cc1d687ae9c0f03644dc2841600fc3f50e5b63fbdbe213be5e67a2"
    },
    {
      "id": "instructions.tests.instructions.md",
      "surface": "instructions",
      "layer": "core",
      "source": "template/instructions/tests.instructions.md",
      "target": ".github/instructions/tests.instructions.md",
      "ownership": [
        "local"
      ],
      "strategy": "token-replace",
      "requiredWhen": [],
      "tokens": [
        "{{PRIMARY_LANGUAGE}}",
        "{{TESTING_PHILOSOPHY}}",
        "{{TEST_COMMAND}}"
      ],
      "chmod": "none",
      "hash": "sha256:3d10a554ff7e0c624db854ab0b4ea27c95397f2b41bf147276d342a68fc3ad77"
    },
    {